{
  "$schema": "http://json-schema.org/draft-07/schema#",
  "items": {
    "additionalProperties": false,
    "properties": {
      "author": { "type": "string" },
      "categories": { "items": { "type": "string" }, "type": "array" },
      "description": { "type": "string" },
      "external": { "type": "boolean" },
      "github": { "format": "uri", "type": "string" },
      "id": { "type": "string" },
      "internalWallet": { "type": "boolean" },
      "logo": { "format": "uri", "type": "string" },
      "priority": { "type": "number" },
      "shortDescription": { "type": "string" },
      "site": { "format": "uri", "type": "string" },
      "telegram": { "format": "uri", "type": "string" },
      "title": { "type": "string" },
      "twitter": { "format": "uri", "type": "string" },
      "url": { "format": "uri", "type": "string" }
    },
    "required": [
      "author",
      "categories",
      "description",
      "id",
      "logo",
      "shortDescription",
      "title",
      "url"
    ],
    "type": "object"
  },
  "type": "array"
}
